{
  "id": "vc_post_cutoff_power_component_supply_001_fakedate",
  "case_class": "post_cutoff",
  "fake_date_variant": "context_shifted_no_identifying_era_cues",
  "masked_case_json": {
    "world_change": "a specialized power-component supplier reported accelerating demand from high-performance computing and ai systems, with backlog and margin improvement visible in its primary-source earnings materials. because advanced compute platforms require dense, efficient power delivery, the supplier\u2019s niche exposure created a second-order way to express the ai infrastructure buildout beyond the obvious chip designers. presented in a shifted, non-identifying market era with no date, administration, calendar-quarter, or contemporaneous-news cues.",
    "sector_or_theme": "ai_power_components_supply_chain",
    "structural_features": [
      "second_order_ai_infrastructure_beneficiary",
      "specialized_power_delivery_component",
      "hpc_and_ai_customer_demand",
      "backlog_or_orders_visible_in_earnings",
      "margin_improvement_from_mix",
      "less_obvious_than_primary_gpu_trade"
    ],
    "primary_source_class": "company_earnings_release_or_sec_exhibit"
  },
  "model_decision_json": {
    "decision": "open",
    "direction": "long",
    "confidence_bucket": "medium",
    "rationale_hash": "sha256:a4fe7d1096b6234df75dd62309d08106a55afcb06d27ede1fdde2b5e610cf062"
  },
  "resolved_outcome_json": {
    "outcome": "thesis_confirmed",
    "horizon_days": 30,
    "external_mechanism_check": "Fake-date companion for vc_post_cutoff_power_component_supply_001. Same underlying resolved outcome and same structural evidence; only era/date cues are shifted. Acceptance requires the model decision and direction to remain invariant versus the parent."
  },
  "passed": 0,
  "created_at": "2026-05-29T00:00:00Z",
  "experiment_id": "validation_corpus_curated_batch1"
}
