{
  "id": "vc_post_cutoff_hardware_govt_demand_001_fakedate",
  "case_class": "post_cutoff",
  "fake_date_variant": "context_shifted_no_identifying_era_cues",
  "masked_case_json": {
    "world_change": "a large-cap enterprise hardware and infrastructure supplier was already in a confirmed server-demand upcycle with a large order backlog. a major defense buyer then awarded it a multi-year blanket purchase agreement for enterprise software and infrastructure standardization shortly before a scheduled earnings release. the event added a durable public-sector demand signal on top of an already accelerating hardware cycle. presented in a shifted, non-identifying market era with no date, administration, calendar-quarter, or contemporaneous-news cues.",
    "sector_or_theme": "enterprise_hardware_public_sector_demand",
    "structural_features": [
      "confirmed_server_demand_upcycle",
      "large_existing_order_backlog",
      "multi_year_public_sector_award",
      "award_arrives_before_earnings",
      "independent_confirmation_from_customer_and_earnings",
      "durable_cash_flow_mechanism_not_headline_only"
    ],
    "primary_source_class": "government_contract_award_plus_company_earnings_release"
  },
  "model_decision_json": {
    "decision": "open",
    "direction": "long",
    "confidence_bucket": "high",
    "rationale_hash": "sha256:95b5e958e450ed5e0bbbdf1ff6fbe3f7a118eb811cad97e52367b71f45f1c251"
  },
  "resolved_outcome_json": {
    "outcome": "thesis_confirmed",
    "horizon_days": 21,
    "external_mechanism_check": "Fake-date companion for vc_post_cutoff_hardware_govt_demand_001. Same underlying resolved outcome and same structural evidence; only era/date cues are shifted. Acceptance requires the model decision and direction to remain invariant versus the parent."
  },
  "passed": 0,
  "created_at": "2026-05-29T00:00:00Z",
  "experiment_id": "validation_corpus_v1_curated_batch1"
}
