{
  "id": "vc_post_cutoff_regional_bank_cre_001",
  "case_class": "post_cutoff",
  "fake_date_variant": null,
  "masked_case_json": {
    "world_change": "a regional bank disclosed in a quarterly filing a sharp jump in non-accrual commercial real estate loans concentrated in office, accompanied by a special allowance build that exceeded prior guidance.",
    "sector_or_theme": "regional_bank",
    "structural_features": [
      "concentrated_office_cre_exposure",
      "non_accrual_step_change",
      "allowance_build_exceeds_prior_guidance",
      "deposit_base_unrealized_loss_overhang",
      "no_prior_capital_action_announced"
    ],
    "primary_source_class": "10_q"
  },
  "model_decision_json": {
    "decision": "open",
    "direction": "short",
    "confidence_bucket": "medium",
    "rationale_hash": "sha256:placeholder_to_be_committed_before_resolution_review"
  },
  "resolved_outcome_json": {
    "outcome": "thesis_confirmed",
    "horizon_days": 90,
    "external_mechanism_check": "subsequent 8-K announced dividend cut and capital raise within 75 days; non-accrual ratio rose further in the next 10-Q"
  },
  "passed": 1,
  "created_at": "2026-05-29T00:00:00Z",
  "experiment_id": "validation_corpus_v1_seed"
}
