{
  "id": "vc_post_cutoff_datacenter_energy_demand_001",
  "case_class": "post_cutoff",
  "fake_date_variant": null,
  "masked_case_json": {
    "world_change": "a distributed power supplier announced a very large strategic procurement expansion with a hyperscale cloud customer for on-site power systems, while also reporting rapid revenue growth and raising full-year expectations. the primary-source pattern showed that ai data-center construction was creating demand for power availability, not only for compute hardware.",
    "sector_or_theme": "datacenter_power_constraint",
    "structural_features": [
      "ai_datacenter_buildout_drives_power_demand",
      "hyperscale_customer_procurement_commitment",
      "on_site_generation_as_speed_to_power_solution",
      "revenue_growth_confirmed_in_earnings",
      "guidance_raised_after_order_signal",
      "power_availability_becomes_bottleneck"
    ],
    "primary_source_class": "customer_supply_agreement_plus_company_earnings_release"
  },
  "model_decision_json": {
    "decision": "open",
    "direction": "long",
    "confidence_bucket": "high",
    "rationale_hash": "sha256:ac7ab2085b26b8ea8c24bd7795e1b62b8cd49ffd6f3c92c0416aa45a40b10608"
  },
  "resolved_outcome_json": {
    "outcome": "thesis_confirmed",
    "horizon_days": 60,
    "external_mechanism_check": "Underlying: Bloom Energy / Oracle. Primary sources: Bloom/Oracle strategic partnership release and Bloom Q1 2026 earnings release. Outcome check: contracted hyperscale demand and raised revenue expectations confirmed the mechanism from AI data-center growth to on-site power supplier cash flows. Do not expose this field to the model during decision generation."
  },
  "passed": 0,
  "created_at": "2026-05-29T00:00:00Z",
  "experiment_id": "validation_corpus_v1_curated_batch1"
}
