{
  "id": "vc_post_cutoff_datacenter_energy_demand_001_fakedate",
  "case_class": "post_cutoff",
  "fake_date_variant": "context_shifted_no_identifying_era_cues",
  "masked_case_json": {
    "world_change": "a distributed power supplier announced a very large strategic procurement expansion with a hyperscale cloud customer for on-site power systems, while also reporting rapid revenue growth and raising full-year expectations. the primary-source pattern showed that ai data-center construction was creating demand for power availability, not only for compute hardware. presented in a shifted, non-identifying market era with no date, administration, calendar-quarter, or contemporaneous-news cues.",
    "sector_or_theme": "datacenter_power_constraint",
    "structural_features": [
      "ai_datacenter_buildout_drives_power_demand",
      "hyperscale_customer_procurement_commitment",
      "on_site_generation_as_speed_to_power_solution",
      "revenue_growth_confirmed_in_earnings",
      "guidance_raised_after_order_signal",
      "power_availability_becomes_bottleneck"
    ],
    "primary_source_class": "customer_supply_agreement_plus_company_earnings_release"
  },
  "model_decision_json": {
    "decision": "open",
    "direction": "long",
    "confidence_bucket": "high",
    "rationale_hash": "sha256:ff92f471616018c80def2631c9a03681e639f1a2a55d555af4fc485b7e9167e3"
  },
  "resolved_outcome_json": {
    "outcome": "thesis_confirmed",
    "horizon_days": 60,
    "external_mechanism_check": "Fake-date companion for vc_post_cutoff_datacenter_energy_demand_001. Same underlying resolved outcome and same structural evidence; only era/date cues are shifted. Acceptance requires the model decision and direction to remain invariant versus the parent."
  },
  "passed": 0,
  "created_at": "2026-05-29T00:00:00Z",
  "experiment_id": "validation_corpus_curated_batch1"
}
