{
  "id": "vc_post_cutoff_seat_model_narrative_001",
  "case_class": "post_cutoff",
  "fake_date_variant": null,
  "masked_case_json": {
    "world_change": "a broad \u201cai will destroy seat-based software\u201d narrative tempted investors to short established workflow-software businesses as a cohort. however, primary-source updates across multiple software names showed that some of these companies were still growing revenue, paid usage, or subscription metrics while embedding ai into the product; the cohort was not monolithic enough for a blanket short.",
    "sector_or_theme": "enterprise_software_ai_disruption_narrative",
    "structural_features": [
      "ai_disruption_narrative_targets_seat_models",
      "cohort_not_monolithic",
      "some_primary_sources_show_growth_not_impairment",
      "ai_can_be_feature_or_margin_tailwind",
      "requires_per_name_net_retention_and_guidance",
      "blanket_short_lacks_specific_cash_flow_falsifier"
    ],
    "primary_source_class": "company_earnings_releases_and_shareholder_letters"
  },
  "model_decision_json": {
    "decision": "no_trade",
    "direction": "none",
    "confidence_bucket": "medium",
    "rationale_hash": "sha256:0ec931c682bf82e81e401cec88c54fd12e5c7fe74d351dfa94797b600bffb700"
  },
  "resolved_outcome_json": {
    "outcome": "thesis_refuted",
    "horizon_days": 30,
    "external_mechanism_check": "Underlying examples: Figma, Workday, and Duolingo primary-source updates. Agent A packets showed revenue/subscription/user growth and AI adoption or cost leverage in several names, refuting a blanket cohort short. Outcome check: this is a discrimination case; the correct model behavior is to require per-name evidence rather than short the entire software cohort from narrative alone. Do not expose this field to the model during decision generation."
  },
  "passed": 0,
  "created_at": "2026-05-29T00:00:00Z",
  "experiment_id": "validation_corpus_curated_batch1"
}
