{
  "id": "vc_post_cutoff_launch_dependency_001_fakedate",
  "case_class": "post_cutoff",
  "fake_date_variant": "context_shifted_no_identifying_era_cues",
  "masked_case_json": {
    "world_change": "a pre-revenue satellite communications company depended on scarce third-party launch capacity to execute an aggressive constellation deployment plan. a catastrophic launch-provider test explosion introduced uncertain return-to-flight timing and materially increased deployment-delay risk, directly weakening the near-term capacity and cash-flow path. presented in a shifted, non-identifying market era with no date, administration, calendar-quarter, or contemporaneous-news cues.",
    "sector_or_theme": "pre_revenue_space_infrastructure",
    "structural_features": [
      "valuation_depends_on_future_deployment",
      "scarce_third_party_launch_capacity",
      "catastrophic_provider_incident_disrupts_launch_schedule",
      "timeline_slippage_hits_cash_flow_path",
      "pre_revenue_model_has_limited_buffer",
      "alternative_provider_capacity_does_not_fully_remove_dependency",
      "uncertain_return_to_flight_window"
    ],
    "primary_source_class": "official_incident_disclosure_plus_company_update"
  },
  "model_decision_json": {
    "decision": "no_trade",
    "direction": "none",
    "confidence_bucket": "medium",
    "rationale_hash": "sha256:be6aa16630981cee8a789e2d777e3e23e889def1e629f5acc47866d2f520b765"
  },
  "resolved_outcome_json": {
    "outcome": "thesis_refuted",
    "horizon_days": 7,
    "external_mechanism_check": "Fake-date companion for vc_post_cutoff_launch_dependency_001. Same underlying resolved outcome and same structural evidence; only era/date cues are shifted. Acceptance requires the model decision and direction to remain invariant versus the parent."
  },
  "passed": 0,
  "created_at": "2026-05-29T00:00:00Z",
  "experiment_id": "validation_corpus_curated_batch1"
}
