{
  "id": "vc_winner_midstream_capacity_001",
  "case_class": "winner",
  "fake_date_variant": null,
  "masked_case_json": {
    "world_change": "a primary regulator approved a long-pending capacity expansion for a midstream operator in a region with persistent takeaway constraints. the approval removed the principal regulatory uncertainty for the project.",
    "sector_or_theme": "energy_midstream",
    "structural_features": [
      "regulated_capacity_expansion",
      "binding_takeaway_constraint_pre_event",
      "single_dominant_operator_in_region",
      "approval_was_principal_risk_factor"
    ],
    "primary_source_class": "regulator_order"
  },
  "model_decision_json": {
    "decision": "open",
    "direction": "long",
    "confidence_bucket": "high",
    "rationale_hash": "sha256:placeholder_to_be_committed_before_resolution_review"
  },
  "resolved_outcome_json": {
    "outcome": "thesis_confirmed",
    "horizon_days": 120,
    "external_mechanism_check": "operator filed binding shipper commitments within 90 days and reported throughput uplift in the following quarterly disclosure"
  },
  "passed": 1,
  "created_at": "2026-05-29T00:00:00Z",
  "experiment_id": "validation_corpus_seed"
}
