{
  "id": "vc_post_cutoff_power_component_supply_001",
  "case_class": "post_cutoff",
  "fake_date_variant": null,
  "masked_case_json": {
    "world_change": "a specialized power-component supplier reported accelerating demand from high-performance computing and ai systems, with backlog and margin improvement visible in its primary-source earnings materials. because advanced compute platforms require dense, efficient power delivery, the supplier\u2019s niche exposure created a second-order way to express the ai infrastructure buildout beyond the obvious chip designers.",
    "sector_or_theme": "ai_power_components_supply_chain",
    "structural_features": [
      "second_order_ai_infrastructure_beneficiary",
      "specialized_power_delivery_component",
      "hpc_and_ai_customer_demand",
      "backlog_or_orders_visible_in_earnings",
      "margin_improvement_from_mix",
      "less_obvious_than_primary_gpu_trade"
    ],
    "primary_source_class": "company_earnings_release_or_sec_exhibit"
  },
  "model_decision_json": {
    "decision": "open",
    "direction": "long",
    "confidence_bucket": "medium",
    "rationale_hash": "sha256:8da4db63753d810f1fd6b0e43d3adf1a4eb27ec18f75a9e1ffe3e20ecdc04bd7"
  },
  "resolved_outcome_json": {
    "outcome": "thesis_confirmed",
    "horizon_days": 30,
    "external_mechanism_check": "Underlying: Vicor. Primary source: Q1 2026 earnings release / SEC exhibit reporting revenue, backlog, and high-performance-computing demand. Outcome check: the stock repriced after the primary-source update as investors recognized the power-delivery bottleneck. Do not expose this field to the model during decision generation."
  },
  "passed": 0,
  "created_at": "2026-05-29T00:00:00Z",
  "experiment_id": "validation_corpus_curated_batch1"
}
