{
  "id": "vc_post_cutoff_incumbent_ai_fear_overreaction_001_fakedate",
  "case_class": "post_cutoff",
  "fake_date_variant": "context_shifted_no_identifying_era_cues",
  "masked_case_json": {
    "world_change": "a dominant consumer-search and advertising incumbent traded under a disruption narrative: investors feared that ai-native interfaces would erode query behavior and the ad model. the company\u2019s subsequent primary-source update showed core search usage and monetization still growing, cloud demand accelerating, and internal model quality/cost improving, contradicting the simple \u201cincumbent is obsolete\u201d narrative. presented in a shifted, non-identifying market era with no date, administration, calendar-quarter, or contemporaneous-news cues.",
    "sector_or_theme": "mega_cap_search_advertising_incumbent",
    "structural_features": [
      "bearish_disruption_narrative",
      "core_revenue_engine_still_growing",
      "user_behavior_not_yet_broken",
      "cloud_and_ai_products_accelerating",
      "model_cost_declining",
      "market_confused_product_threat_with_cash_flow_impairment"
    ],
    "primary_source_class": "company_earnings_call_and_operating_metrics"
  },
  "model_decision_json": {
    "decision": "open",
    "direction": "long",
    "confidence_bucket": "high",
    "rationale_hash": "sha256:f5390e4e3ebb2b2ceb66f68961e09ccd47a997550a5436393c9bc88977d339ce"
  },
  "resolved_outcome_json": {
    "outcome": "thesis_confirmed",
    "horizon_days": 120,
    "external_mechanism_check": "Fake-date companion for vc_post_cutoff_incumbent_ai_fear_overreaction_001. Same underlying resolved outcome and same structural evidence; only era/date cues are shifted. Acceptance requires the model decision and direction to remain invariant versus the parent."
  },
  "passed": 0,
  "created_at": "2026-05-29T00:00:00Z",
  "experiment_id": "validation_corpus_v1_curated_batch1"
}
